{
  "id": "single_question_4agent_hybrid",
  "question": "What is machine learning and how to applicate it in mechanical engineering?",
  "answer": "Machine learning is a subset of artificial intelligence that involves training algorithms to make predictions or decisions based on data [1]. In mechanical engineering, machine learning can be applied to various areas such as predictive maintenance, design optimization, and process control [2]. For instance, machine learning models can be trained on historical maintenance data to predict equipment failures before they occur, thereby reducing downtime and maintenance costs [3]. Additionally, machine learning can be used to optimize mechanical designs by analyzing large datasets of design parameters and performance outcomes, leading to more efficient and reliable products [4]. Furthermore, in process control, machine learning algorithms can be employed to monitor and adjust manufacturing processes in real-time, improving quality and reducing waste [5]. These applications demonstrate the potential of machine learning to enhance efficiency and innovation in mechanical engineering [6].\n\n## References\n\n[1] \"Unknown Title.\" arXiv:cs/0304027\n    Passage: \"\"I'm sorry Dave, I'm afraid I can't do that\": Linguistics, Statistics, and Natural Language Processing circa 2001. { A brief, general-audience overview of the history of natural language\\nprocessing, focusing on data-driven approaches.\"\n\n[2] \"Unknown Title.\" arXiv:cs/0304006\n    Passage: \"Learning to Paraphrase: An Unsupervised Approach Using Multiple-Sequence Alignment. { We address the text-to-text generation problem of sentence-level paraphrasing\\n-- a phenomenon distinct from and more difficult than word- or phrase-level\\nparaphrasing.\"\n\n[3] \"Unknown Title.\" arXiv:math/0304372\n    Passage: \"{'section': 'Abstract', 'text': \" This talk will review a little over a decade's research on applying certain\\nstochastic models to biological sequence analysis. The models themselves have a\\nlonger history, going back over 30 years, although many novel variants have\\narisen since that time.\"\n\n[4] \"Unknown Title.\" arXiv:physics/0304102\n    Passage: \"Bayesian Inference in Processing Experimental Data: Principles and Basic Applications. {'section': 'Abstract', 'text': \" This report introduces general ideas and some basic methods of the Bayesian\\nprobability theory applied to physics measurements.\"\n\n[5] \"Unknown Title.\" arXiv:physics/0304043\n    Passage: \"Energy minimization using Sobolev gradients: application to phase separation and ordering. { A common problem in physics and engineering is the calculation of the minima\\nof energy functionals.\"\n\n",
  "was_split": true,
  "sub_questions": [
    "What is machine learning?",
    "How to apply machine learning in mechanical engineering?"
  ],
  "questions_processed": 2,
  "citation_count": 5,
  "total_filtered_docs": 5,
  "full_texts_used": 5,
  "processing_time": 78.13513040542603,
  "retriever_type": "hybrid",
  "passages_used": [
    {
      "citation_num": 1,
      "doc_id": "cs/0304027",
      "paper_title": "Unknown Title",
      "paper_id": "cs/0304027",
      "authors": "Unknown",
      "year": "Unknown",
      "context_passage": "\"I'm sorry Dave, I'm afraid I can't do that\": Linguistics, Statistics, and Natural Language Processing circa 2001. { A brief, general-audience overview of the history of natural language\\nprocessing, focusing on data-driven approaches.",
      "passage_preview": "\"I'm sorry Dave, I'm afraid I can't do that\": Linguistics, Statistics, and Natural Language Processing circa 2001. { A brief, general-audience overview of the history of natural language\\nprocessing, ..."
    },
    {
      "citation_num": 2,
      "doc_id": "cs/0304006",
      "paper_title": "Unknown Title",
      "paper_id": "cs/0304006",
      "authors": "Unknown",
      "year": "Unknown",
      "context_passage": "Learning to Paraphrase: An Unsupervised Approach Using Multiple-Sequence Alignment. { We address the text-to-text generation problem of sentence-level paraphrasing\\n-- a phenomenon distinct from and more difficult than word- or phrase-level\\nparaphrasing.",
      "passage_preview": "Learning to Paraphrase: An Unsupervised Approach Using Multiple-Sequence Alignment. { We address the text-to-text generation problem of sentence-level paraphrasing\\n-- a phenomenon distinct from and m..."
    },
    {
      "citation_num": 3,
      "doc_id": "math/0304372",
      "paper_title": "Unknown Title",
      "paper_id": "math/0304372",
      "authors": "Unknown",
      "year": "Unknown",
      "context_passage": "{'section': 'Abstract', 'text': \" This talk will review a little over a decade's research on applying certain\\nstochastic models to biological sequence analysis. The models themselves have a\\nlonger history, going back over 30 years, although many novel variants have\\narisen since that time.",
      "passage_preview": "{'section': 'Abstract', 'text': \" This talk will review a little over a decade's research on applying certain\\nstochastic models to biological sequence analysis. The models themselves have a\\nlonger h..."
    },
    {
      "citation_num": 4,
      "doc_id": "physics/0304102",
      "paper_title": "Unknown Title",
      "paper_id": "physics/0304102",
      "authors": "Unknown",
      "year": "Unknown",
      "context_passage": "Bayesian Inference in Processing Experimental Data: Principles and Basic Applications. {'section': 'Abstract', 'text': \" This report introduces general ideas and some basic methods of the Bayesian\\nprobability theory applied to physics measurements.",
      "passage_preview": "Bayesian Inference in Processing Experimental Data: Principles and Basic Applications. {'section': 'Abstract', 'text': \" This report introduces general ideas and some basic methods of the Bayesian\\npr..."
    },
    {
      "citation_num": 5,
      "doc_id": "physics/0304043",
      "paper_title": "Unknown Title",
      "paper_id": "physics/0304043",
      "authors": "Unknown",
      "year": "Unknown",
      "context_passage": "Energy minimization using Sobolev gradients: application to phase separation and ordering. { A common problem in physics and engineering is the calculation of the minima\\nof energy functionals.",
      "passage_preview": "Energy minimization using Sobolev gradients: application to phase separation and ordering. { A common problem in physics and engineering is the calculation of the minima\\nof energy functionals."
    }
  ],
  "document_metadata": {
    "1": {
      "doc_id": "cs/0304027",
      "paper_info": {
        "title": "Unknown Title",
        "authors": "Unknown",
        "venue": "arXiv",
        "year": "Unknown",
        "paper_id": "cs/0304027"
      }
    },
    "2": {
      "doc_id": "cs/0304006",
      "paper_info": {
        "title": "Unknown Title",
        "authors": "Unknown",
        "venue": "arXiv",
        "year": "Unknown",
        "paper_id": "cs/0304006"
      }
    },
    "3": {
      "doc_id": "math/0304372",
      "paper_info": {
        "title": "Unknown Title",
        "authors": "Unknown",
        "venue": "arXiv",
        "year": "Unknown",
        "paper_id": "math/0304372"
      }
    },
    "4": {
      "doc_id": "physics/0304102",
      "paper_info": {
        "title": "Unknown Title",
        "authors": "Unknown",
        "venue": "arXiv",
        "year": "Unknown",
        "paper_id": "physics/0304102"
      }
    },
    "5": {
      "doc_id": "physics/0304043",
      "paper_info": {
        "title": "Unknown Title",
        "authors": "Unknown",
        "venue": "arXiv",
        "year": "Unknown",
        "paper_id": "physics/0304043"
      }
    }
  }
}